title,upvotes
Sustained interest and actions post Behavioural assessments,3
"Bi-Weekly /r/IOpsychology Discussion - What have you been reading, and what do you think of it?",2
skills-ml,3
Compassion as a Daily Practice -- leadership skills,0
Jobs outside of corporate or general career advice?,13
How serious is the researcher and practitioners gap is?,12
Factor analysis vs. network analysis,7
Advice,4
Good jobs for IO graduate students?,9
Seeking open source syllabus for intro IO psych class,6
Conclusions from Landers et al. 2023,23
Management of Dependent Personality Disorder in the Workplace,4
Should I go to Academy of Management Conference?,6
Examples of personality tests used in selection?,2
I got passed over for a job because I stated in the future I would like to have a different job at the same place,8
Career advice,4
Defining I/O psychology to the general public,9
Interview questions or group interviews,1
job prospects in canada and germany,1
SIOP 2023,19
I/0 QUESTION???,0
Question about calling yourself a psychologist ,9
Compensation Research in IO Psychology,10
Team interventions,5
"How much do you advice is a fair cost for a project involving: designing a culture survey, running it on quarterly basis over a year (two full and two pulse checks), data analysis, report writing and presentation of results (PPT and reports x 4; one set per survey). Its a small organisation.",3
"Bi-Weekly /r/IOpsychology Discussion - What have you been reading, and what do you think of it?",6
Undergraduate jobs,5
2023 Graduate Program start,20
Undergrad seeking field related jobs,11
Job search is bleak,21
PI Behavioral Test,3
"This Thursday: a panel on life after grad school, focusing on the job search and career paths. Register using the link: http://bit.ly/LifeAfterGradSchool",27
AI Affecting I/O?,17
Conducting Independent Research?,9
Any recommendations for internships to look for?,10
New allegations of research misconduct centered on Francesca Gino,50
What can I do to get more money?,10
Looking for jobs after graduating from a Masters Program,21
New graduate looking jobs in Netherlands,4
"Personnel/Work Assessment: should a ""perfect"" score be attainable?",13
Soon to be MSc Business Psychology Graduate,9
Good introductory I/O textbooks?,16
"Bi-Weekly /r/IOpsychology Discussion - What have you been reading, and what do you think of it?",4
Resources on Critical Roles,9
2023 Grad School Q&amp;A Mega-Thread,26
Employee Engagement in Large Company,12
Best Stats Courses to Prepare for Masters Program?,12
Questions on determining the sample sizes for pulse surveys,11
Korn Ferry 360 Certification,8
"As current IO practitioners and lifelong IO ""students""",16
Free time among academics vs practitioners?,9
Proposing to Volunteer to do HR Analytical Work in Current Role (HRC),4
Searching UK Internships,2
What Were Your GRE Scores? [Admission for Masters Programs],3
Possible Internship Advice,8
Im looking into applying for the masters program near me. One of the requirements is a LOR from a psychology professor. Ive been out of school since 2017 therefore dont have any relationship with previous professors. Does anyone have any advice? Feeling kind of stuck with that.,7
MBTI &amp; Big five,10
Just curious on some career choices within this field? I went to college w the intention of following w my masters in IO psych..,7
Best route to get into consulting or to work for a consulting firm?,8
Shadowmatch,1
Non-academic research jobs,8
Salary Outlook For Master's-Level I/O Psychologists,17
How to Break Into I/O Jobs?,9
Masters in I/O in Canada - Job Prospects?,4
Questions About Prospective Online Grad Program,1
A fork in my career path.,10
Internships are Tough: An Overview of One Grad Student's Experience,35
Self-Taught Stats,14
I/O Related job?,8
"What's a statistical / research methodology, that's not usually taught in grad programs, that you think more IO's should be aware about?",23
"Bi-Weekly /r/IOpsychology Discussion - What have you been reading, and what do you think of it?",3
HR undergrad - can I still get into a Masters in I/O?,9
Any Good I/O Related Jobs Before Getting Masters?,18
Repository of assessments?,4
Career advice,9
"Pyschometric experts / IO Pyschologist, how did you switch jobs?",9
Malpractice insurance for independent consultants?,3
Is this the right flow for a workshop?,1
AI seems poised to take over many jobs how will this affect I/O as a field,15
Advice for current undergrad?,11
Best books for someone learning SPSS for the first time?,3
Career Change - Tech Exec to Psychology - Ideas &amp; Help?,3
Getting an entry level job,12
Licensure for consulting/networking,9
Getting into IO Psychology in college?,8
Feeling Stuck,20
Organisational Health Index (OHI),4
Looking for recommendations on books on structured interviews,11
"Bi-Weekly /r/IOpsychology Discussion - What have you been reading, and what do you think of it?",6
Salary and growing areas of I/O,1
Summer Internships,14
Does the B.A. / B.S. distinction really matter for grad school/job apps?,11
NYT DEIB Article,3
What does research look like in IO Psych?,5
Is a phd worth it if I dont want to go into academia?,27
"Does anyone have any ideas or suggestions for a topic question to research for a psych thesis, thats related to IO psychology?",1
Is majoring in business a good idea?,11
Psychology Applied to Work,2
Idea for an intervention on student organization member retention,4
ONA for performance reviews,5
Why not select on intelligence?,7
Would I be able to,4
What made you choose IO over other areas of psychology?,18
NYU vs Columbia vs Baruch Masters,2
"Having a hard time understanding the career path of a IO major. I have a psych degree and work in logistics transportation. Looking to move into something else and get a master in either HRM or IO. I get where youd go with HRM, but what are the actual jobs youd land with a masters in IO?",11
"Studying Abroad, and Working at Home",7
Is the GRE Worth It?,8
Leader Influence Course,0
grad cap ideas?,2
How to learn R for free?,45
Advice regarding Masters in OD vs HRM,2
completed masters in I/O looking for courses,1
Academics: think about the best grad-student youve ever had or worked with. What made them so great?,15
Performance Review Software?,7
Informational book recommendations,8
Transitioning from clinical psychology to I/O,5
Research regarding job applicants being too experienced?,12
Recruiter a good first job?,5
How competitive is getting into a masters programs for I/O psych?,5
I met some practitioners at the conference and they had an assessment tool for practice that measured something specific that interested me. Would it be rude to ask about taking the assessment at a discount or even for free just to see how it works?,5
Help! I suck at Facilitations/Workshops!,9
SEM Help,6
Please help me answer this question,0
"Bi-Weekly /r/IOpsychology Discussion - What have you been reading, and what do you think of it?",4
How can IO Psychology be leveraged to fight the War on Climate Change?,14
The Chicago White Sox: Narcissistic Leadership Tendencies at the Top,12
Most popular meta-analyses,18
PhD vs. Work after Master?,6
Internship Opportunities,11
how easy would it be to get into I/O psychology with a master's in mental health counseling,5
Job Description,5
Social psychology PhD,14
Average GRE scores?,5
GRE Scores,3
time well spent in lab meetings,5
Writing A Job Analysis,20
Seeking Advice for conducting Future-Oriented Work Analysis with a Small Sample,5
Research on one-year timeline for employee onboarding?,3
Websites or platforms with stock of questions,6
"Non-EU, Non-Dutch speaker, Social, Health and Organizational Psychologist graduated from Dutch university trying to find a job",4
Passive Income,14
Hows the job market within IO or Hr right now?,14
Connecting / Networking in the Bay Area?,8
Anyone knows any research on relationship between PERCEIVED ORGANIZATION POLITICS and TURNOVER INTENTION. ???,0
HARKing,6
"Bi-Weekly /r/IOpsychology Discussion - What have you been reading, and what do you think of it?",4
What are the most essential parts of stats to know for going into industry?,15
Does IO seem like a good fit?,4
IO Psych question,4
Rejecting a job offer that I really wanted&,20
POP and TOI scales,1
IO psychology to Clinical Psychology. How difficult?,11
Academia is broken ....,33
Best validated and reliable psychometric tools?,12
Is ETS a good company to join as a psychometrician?,12
SHRM Certification?,11
Career paths,7
Im currently an instructional designer. Going to the consultancy route. Helping companies develop elearning programs and departments. Would pursuing I/O psychology help my career?,10
"Found this sub and am now panicking, looking for advice",15
Looking on SIOP website for call for proposals for 2024 conference,3
Any good bachelors programs for I/O psychology in California?,3
"Bi-Weekly /r/IOpsychology Discussion - What have you been reading, and what do you think of it?",8
Anyone applying for a Master's in I/O Psychology course for 2024? Is I/O worth it?,30
"BusinessInsider: Francesca Gino's $25 million lawsuit will scare researchers away from calling out suspected fraud, scholars fear",18
Journals for Current Work Motivation Research?,7
Why do psychometricians use interaction model instead of Chi square to test fit of data?,1
"Thoughts on the recent HR tech consolidation? (Perceptyx acquires Humu, HireVue acquires Modern Hire, Harver acquires Pymetrics)",30
Scope of IO psych,1
Job Help,7
AI and I-O Psychology,6
I want to switch away from our field. What careers would be easy to transition to?,17
Should I keep studying this?,6
Graduate Level Internship Searching,12
Entry-Level Psychometrics,15
Does anyone know whats the average pay for occupational psychs with 5-10 exp in the UK?,6
I/O jobs in New England?,8
Business vs IO electives,3
What upskilling and further development should I undertake as an IO psych grad?,13
Wanting to Move Away from HR and utilize my M.A. IO degree [California],11
wasn't planning on going into HR but it seems like the easiest option,7
Looking for some research-backed change resistance models,7
Help me please,1
A few questions about careers in IO Psych,19
"Bi-Weekly /r/IOpsychology Discussion - What have you been reading, and what do you think of it?",3
Board Review Help!,6
Help,4
how much research/data knowledge do you need before doing an IO Mc?,5
How has survey fatigue affected your organization? How do you proactively manage survey fatigue?,9
Easy-to-read introductory texts on structured interviews?,9
Where can I sign up to do volunteer research/data analysis?,4
Alternative Method to Standardizing Test Scores,6
"Why do 'wellbeing agencies' rarely show ROI on their interventions, or any monetary results?",6
[Discussion] Where are the posts about the NYC teachers exam payouts? This is huge I/O News.,8
How to transition Clin Psych to IO Psych,10
Literature/white papers about hiring assessments?,9
Are you a consultant?,13
 I havent read one single book or article after I graduated,32
Where can I learn to do surveys,6
"Hey! Does anyone have a good dissertation topic idea related to leadership and trust? Im hoping to collect the majority, if not all of my data online, so bonus if the topic allowed for that. Thanks!",0
How difficult was it for you to find a well paying career after you graduated? And more questions.,21
Literature recommendations on employees refusing promotion,8
Exit interview resources,3
Are there undergraduate IO programs?,8
Measuring Regrettable Loss,4
CV,7
"Bi-Weekly /r/IOpsychology Discussion - What have you been reading, and what do you think of it?",4
Can you recomend interesting Industrial/organizational Psycology literature to help me prepare for my gradschool interview?,15
Transitioning to IO Degree with a Varied HR Background and a 2.7 GPA,6
"Hey guys! Looking for grad schools for Industrial and Organizational Psychology! Whatre the best grad schools in your opinion with excellent programs. Any recommendations within Europe, Canada, and or the States?",0
How will we test AIs for IQ?,4
training and development articles recs?,9
Advice for an undergrad,11
Time from ad to hiring,6
Internship Questions,14
Finding Research Lab?,6
Best place to intern for I/O Psychology during school? Best way to get an internship?,3
Obtaining Item Desirability Ratings automatically using NLP: Paper and Web Application,5
audiobook recommendations,2
what do you learn from a research paper?,16
Im considering a Masters in Industrial and Organizational Psychology. What jobs would be available to me post-graduation? HR jobs are recommended. Anything else? Please share your own experiences.,22
"Python! How to learn it? There is plenty of information online, so its hard to find the right path for IO psych. I remember I did an R course in Coursera that wasnt useful but a uni paper in a stats made all the difference. Any tips on how to start right on python?",14
Double Major + Minor for I-O Career?,8
"Applied Researchers: if you could do your PhD over again, how would you do it?",15
"According to this study by Qualtrics, 46% of market researchers feel 'very confident' using AI in their work.",2
I/O psychology or pursue school psychology??(please help),4
2023 SIOP salary report,10
Question on job analysis survey items,1
"Bi-Weekly /r/IOpsychology Discussion - What have you been reading, and what do you think of it?",6
Summer remote internships? Gaining experience in I-O,12
Seeking your positive work life stories,14
Current scenario of I/O or WAOP in UK and Australia?,9
"I desparately want an accademic research career, but I don't feel set up for success due to a lack of social support.",9
im a clueless college student but IO Psych is the first time ive felt like damn.. this is something i really want to pursue,36
career change,8
Changing career from teaching to consulting/IO related jobs,9
best way to break into this field?,12
Where to get research experience while not in school?,7
Course Syllabus on Mixed Methods Research?,3
STEM I/O,5
Career Advice for a PhD Student in Organizational Behavior,7
Can a Masters in I/O Psych allow me to teach undergraduate psychology?,13
Regular content you review as a practitioner?,1
"Bi-Weekly /r/IOpsychology Discussion - What have you been reading, and what do you think of it?",3
Hogan 360 Certification Vendors,3
Talent Acquisition Interview Workforce Capacity Analysis,7
GPT use cases,10
Any PhD students decide to master out instead? How did it work out for you?,12
Need Advice and Suggestions,2
SIOP Guidelines for Education and Training,8
School interview,2
Professional inquiry,5
Confused About My Path (Undergraduate),8
Research on Family-Supportive Supervisor Behaviors,1
"Advice: People analytics, HCM, or HR technology enablement",8
Happening TODAY (Nov 6) and Nov 7: SIOP hosting a conference for undergraduate students interested in pursuing a PhD in I/O.,11
We are in the top 50 of psychology subreddits!,61
Time to finish degree,2
Action planning sensitive surveys,4
Assessment Help - Scoring for Speed and Accuracy,1
IO Psychology or Data Science? Question?,10
Why is MTSU IO Psychology program so acclaimed?,12
"Bi-Weekly /r/IOpsychology Discussion - What have you been reading, and what do you think of it?",3
Had someone ask me today about the CliftonStrengths personality assessment. Is anyone familiar with it?,11
SIOP Jobnet Website,11
"Recent IO psych masters graduate hit a wall on long job search, any advice?",53
Choosing a Degree/Direction,9
Best and Worse Part of Your Job,13
I/O Psychologists what is your job title,70
IO psych or not,13
"Free virtual conference for undergraduate students interested in obtaining a PhD in I/O, hosted by SIOP on Nov. 6th and 7th. Save the date!",13
Behavioural Interview,15
"What is the viability of projection testings? How much they are accurate in accessing an individual's personality, what are its limitations?",2
"Bi-Weekly /r/IOpsychology Discussion - What have you been reading, and what do you think of it?",5
Is another masters in quantitative methods or data analytics worth it?,6
ADHD at Work - Research,6
Can anyone who landed a job in the past few years please share an anonymized version of their resume?,21
How important is enjoying generalist HR work when determining if IO is right for me?,8
Career kickstart,9
Why do so many I/O folks become self-employed consultants and how viable is that really?,27
Skills assessments,5
Im really confused about my pathway to becoming a organisational psychology (need assistance),4
Meeting facilitation question,2
ChatGPT saturday fun - prompts I used,8
Any Organisation Change Management Consultants in this sub?,7
Scholarships for MS in IO Psych.,3
Certs / Courses under $500,6
Persuade me into pursuing a masters in IO Psych,0
Best place to find Case Studys?,0
Opinions on eNPS?,5
"Bi-Weekly /r/IOpsychology Discussion - What have you been reading, and what do you think of it?",5
Breaking into Consulting with an I/O Degree: Seeking Insights &amp; Guidance,10
Pre-grad research,4
Talk me in/out of reaching out to a company about my dream job posting,11
Working in Compensation as an I/O?,4
IO Psychology and PR,3
Grad Student Informational Interview,7
"Employees are often frustrated by their organisation. A simple notion, the principal-agent problem, provides many insights into why it is the case.",8
Clarification on what counts as a criterion validation study (uniform guidelines Q),8
IO in MA or Applied&which to choose?,4
First Career Step I/O (I hope) - Nonprofit HR Generalist,5
"For those of you that went applied, how did you handle theory-heavy readings in grad school?",13
Interview Prep,4
What is usually the longest section of a research article?,3
"Can creativity/innovation be ""managed""?",8
"Bi-Weekly /r/IOpsychology Discussion - What have you been reading, and what do you think of it?",3
Applicant reactions to selection tools,10
I/O Psych job outlook and security within the next 10 years,18
Advice needed for STEM IO psych colleges,6
Could Waffle House claim fighting is a BFOQ?,17
Master's in IO Psyc ( ~1.5 yrs post-grad) Looking for Job Search Advice!,18
Deprogramming the Cult of the Workplace Personality Test,9
Teams Needs Assessment,3
Industrial and Organizational Psychology Generalist Certificate,5
Landing a Job After Getting Masters,6
Organisational psychology in Australia,5
Looking for advice on analyzing survey data and best practices,7
Human Resources Career vs. Consulting,10
Graduating IO Psych student,9
Looking for a job after my degree,3
Anyone using Generative AI effectively in industry yet?,11
What would be included in the I/O Psych Iceberg? [Discussion],12
Collaboration VS Performance Management,6
Companies that would benefit from a training program?,2
Just got rejected for a Talent Development role for my personality,45
Do you have any must read articles or any other literature?,7
I/O Adjacent Work?,6
Deploying selection assessments,5
advice,4
How many of you work in consulting and how applied do you get in that realm?,3
Do I/O Psychs need a background in developmental psychology?,5
Transitioning Careers,6
Best certificate program for I/O psych,5
Are internships in HR recommended if I eventually want to do a Ph.D. in OB?,5
Math/Stats Knowledge Required to be an I/O Psychologist?,10
I heard about this conference open to any I/O's interested in diversifying the field.,3
Minor in Business Administration or Human Resources?,3
paths to IO Psych?,3
What is an acceptable salary for this position?,1
FYI: Virtual event Jan 16 from MMPAW if you're looking to build your IO consultancy,8
"Bi-Weekly /r/IOpsychology Discussion - What have you been reading, and what do you think of it?",5
"I'm 15 years old and thinking of pursuing the same job as my aunt, I still don't have proper knowledge of Industrial and Organizational Psychology. It will be great if you can give me your opinion in this kind of topic in simple terms (Thank YOU!!!)",3
Planning to get a I/O psychology M.A,8
"""Head of Organizational Behavior Services"" as my title and experience. Where to build on a bachelors? Looking for input.",4
Looking to study IO Psychology Abroad,9
I/O psych bachelors + different behavioral/psych masters concentration.,3
Intro to Human Resources non Transferable (I/O - Applied Psych Major - HR Minor),3
"I/O accelerated masters, I/d/k? Indecisive &amp; worried..me too.",5
Side hustles,7
Associate's in Human Resource Management then Bachelor's in Applied Psychology?,4
Book recommendations,12
What is your 2-Minute Elevator Speech?,5
Resume for Grad School Application,7
what skills are required to be better than others?,4
Predatory Graduate Programs in I-O Psychology,59
Work Sample/Portfolio,1
Reputable IO Training/Certs,10
Masters vs Bachelors,4
Selection Assessment suggestions,3
"Practitioners with PhDs, how much research do you do?",7
What statistical analyses should I do if I have multiple post-tests?,6
Masters in Psychology (Clinical or industrial),1
Career Transition to IOP,5
How did you obtain clients as an I/O consultant?,20
data science,6
alone time?,8
Additional Income?,21
scope of io in uk,8
Stats course,5
Choices,5
Advice on entering this field!,8
Experimental research approach,2
I-O Psychology in the Age of AI,6
"Bi-Weekly /r/IOpsychology Discussion - What have you been reading, and what do you think of it?",7
Jobs Titles for Selection and Assessment,14
salary?,27
I'm taking a class called advanced personnel psychology. What can I do to to prepare myself?,5
Is GPA a flawed academic performance metric?,6
Looking for career in Survey Analysis/Design,11
career path,4
SIOP Conference - should I attend?,13
Keywords for job searching?,10
Pivoting into People Analytics from Social/Clinical Research,5
How Will AI Revolutionize Talent Assessments In 2024?,6
Studies on how excessive meetings benefit slackers?,6
Can someone recommend any reference books for various assessments?,6
Best european city to work in i/o psychology?,8
Consultant,4
Which program,1
Conference decisions,10
Conference decisions,3
Erasmus Mundus Wop,6
Positive/ Inspiring I/O Stories,15
Curious Counseling Master Student,5
How involved were your committee members in helping you develop your dissertation?,6
Is it okay to submit a CV with internship applications?,8
what are some good book to read on IO psychology for a beginner?,17
Dual bachelor's degrees - a good idea or unnecessary?,5
Best Resoures for Learning IRT in R?,9
Challenge finding a career according to personality,0
Is this the right subreddit to talk about job crafting and work design?,10
"Bi-Weekly /r/IOpsychology Discussion - What have you been reading, and what do you think of it?",3
South African Junior Graduate options,4
is what i'm interested in a subtopic of IO Psych or is it more closely related to something else?,7
Jobs,0
Job scene in USA,11
Consulting,3
Not sure who else has put more energy into helping people get into IO,78
We still have a little time left before AI takes our jobs.,22
A Lurker Posts,7
Organizational Behaviour vs I/O psychology vs Psychology?,13
"ChatGPT/DALLE rendering of a ""stereotypical IO psychologist actively working""",19
How to learn R programming if you have no coding background?,38
How to deal with the 100+ facets of the Wave questionnaire...,8
Outside opportunities for a research career?,3
Statistics for feds in I/O,8
Recommendations for undergraduate-friendly Personnel Psychology textbooks?,4
Has anyone decided to start their own consulting business? What are some tips for running your own firm ? How did you start and where how do you attain leads?,10
Struggling to find job in IO after graduating,41
Grad students: How much drama is in your department?,6
SIOP 2024?,3
Regretting M.S. I/O,36
Personal Thoughts on IOPsychology,4
IO Psych in the UK,7
Developer Experience vs IO Psychology,8
Social structures in remote vs. in-person work,5
Exam plans for job analysis,3
Subsidized Certs,2
Job prospects after completing my masters degree in business psychology in Uk,5
Good YouTube videos for job analysis activities?,6
interview invite,2
People Analytics Technical Interview,7
I/O Hot Takes,52
"Work, Sleep and Stress | How Job Passions Influence Well-being",7
What do you work as a IO Psychologist? ,25
Meaningful Internship Recs?,4
Work-Life Balance &amp; Business Consulting ,15
Bank CEO leadership,0
Is police or a start up businnes more transactional,0
Thoughts on 'Insights'?,7
Is it necessary to have work experience before applying to grad school?,8
Survey Researcher,6
Anyone with an M.S. in I-O Psych working in Operations at a Company? Career Question,4
Research Topic Suggestions,0
Invitation for Professionals,3
Advice for a highschooler,4
Why does online ranking site US News say that University of Minnesota TC offers a masters in IO Psych when it is the Duluth campus that offers it only?,4
What kind of internship expereince will help with grad school applications?,4
Certificate programs for I/O psych,4
"ATTN: SIOP members, your input needed!!",13
Leadership Skills Assessment Tools ,4
"What is the difference between work, organisational and Human Resources psychology ",2
"Job Search, M.A in IO",29
Learning Masterclass: Why Learning Isn't a Spectator Sport with Charles Jennings,5
"Bi-Weekly /r/IOpsychology Discussion - What have you been reading, and what do you think of it?",5
Career change,10
Serious question ,13
How to proactively measure strain/burnout/employee well-being?,8
[Philippines] Engagement Consultant,5
Any advice for some grad students starting a pro bono consulting group?,8
How do you assess quality of primary research,6
Cornell career fairs this spring?,0
I/O domains,2
Deciding between social or cognitive psych supervisor for undergrad thesis,3
WOP-P,0
I/O psychology in esports?,5
Chances of finding jobs during SIOP?,8
Leadership Development,7
Unfulfilling Job,39
I/O psychology or Clinical psychology?,2
