title,upvotes
"People who have had an interview for the masters, what is your biggest piece of advice?",7
How to talk about validity and reliability in laymans terms,5
"Hello. I'm from India,I am interested in studying Organisational Psych in the UK so applied for a few courses, got an Offer Letter from Birkbeck for their MSc in Organisational Psychology program, is it a good course,good university? can someone from the UK please answer.",0
Interesting gamification personality test,41
"Hello all, I am looking into some distance learning I.O phycology in Germany in private universities, I want to jear some general opinions for thoose, has anyone studied or has connections that studied there and can provide any info ?",1
How much psychology do you use in your job?,10
Interesting traitify discussion,7
SHRM,2
LinkedIn as a new selection method,3
Manufacturing?,1
SHRM C Student Fee,3
best undergrad double major OR minor?,4
Why I/O?,9
Is anyone familiar with both SIOP and SOHP?,7
The SIOP 2024 Machine Learning Competition is Now Live,11
Advice for I/O Psychology,3
Behavior Change/Change Management Resources,2
Stuck in limbo,3
"If I wanted to pursue psychometrics, would a masters in stats be better or should i still pursue I/o psych",3
You think a software can combat employee survey fatigue?,3
"Bi-Weekly /r/IOpsychology Discussion - What have you been reading, and what do you think of it?",5
Would you recommend a non-us to do masters in the USA?,3
[X-post] useless interview questions,10
Who here has left I/O and then successfully returned to I/O?,5
4+1 IO Masters Program  thoughts?,7
Organizational psychology - need guidance on Canadian certifications,5
Join the 2024 SIOP Machine Learning Competition,16
Bachelor's Degree for an I/O Psych Career,4
"non-EU, IO Careers",1
How likely do you guys think it is that AI will take your job?,3
So like&what do you guys do as industrial organizational psychologists on a daily basis?,27
Research Question,2
Struggling with job search any recommendations?,6
Connections to health and positive psychology,9
CORE RECON Assessment,4
Any recommendations for IO Psychology graduate programs?,0
Internship opportunities for IOP PhD students?,6
"Any Open Access ""top journals"" in our field?",1
Ambient Data Analytics,3
MBA and Master of I/O? Worth it?,3
graduate programs/ best career path ?,3
Jobs for new IOP grad students,11
Well-being at Work,18
Suggestions for IO research topics related to game industry,6
"Canadian IOs, how are we doing in this job desert",7
Should I get a data r programming certificate that my college offers as well as my bachelors in psych?,8
What is your Job Title?,29
Only in America?,2
Undergraduate Path - Business Double Major?,2
Is studying cognitive psychology/knowledge acquisition in undergrad going to help with I/O Psych grad school &amp; field work?,2
"Bi-Weekly /r/IOpsychology Discussion - What have you been reading, and what do you think of it?",3
Resume Review Help for Grad School,3
How to become an IO Psychologist,9
Resume/CV advice,8
io psych masters programs??,0
I got accepted !!!,4
Looking for OD intensive training ,1
#SIOP24 - communication #IOPysch to the C-Suite,2
SIOP virtual sucks ,16
Seeking copy of or live link to journal article ,1
Update on Previous Post (Warning: Sad),30
B.A in psych w/ concentration in IO1 year left.,5
Recent IO Masters grad& ,27
"Bi-Weekly /r/IOpsychology Discussion - What have you been reading, and what do you think of it?",3
Should I stay at my job or look for a job with more growth opportunity?,5
Advice for networking at SIOP National Conference?,8
Not My Job! How will AI Affect IOP in the next 5 years?,2
AI and the quality of life ,1
Highest paying branch of IO psychology,18
Highly Influential Papers of the Last 10 Years,35
Anything similar to SIOP for within Australia ,8
convert_to_minutes &lt;- function(time_string) {... %&gt;% ??? %&gt;% profit,0
Independent research or name attached to professors research @ undergrad level,5
entry level job suggestions,6
Laid Off From Tech - Looking to Pivot to I/O Degree and Job.,12
Felt/Rag-Type SIOP Posters,1
i secured a position as an RA for an I/O psychology lab this fall! what can you guys tell me about I/O psych?,5
Day in the life of an IO Psychologist,19
Workday Certification ,5
Are HR folks delusional by justifying this to be added in their job posting?,100
NYU and TC students/alumni,1
I need some guidance.,2
Any IO psych here currently working in Business Analytics?,7
Writing and Publishing Book Reviews.,2
How to equate two tests which have no item in common? Which techniques do psychometricians use? Any names?,5
counseling vs io psych?,2
Join us for the 2nd annual IO discord meetup @ SIOP!,21
Learning and development professional,5
PhD student looking for feedback on resume,12
What are some current trends/news coming out about how organisations are changing?,9
Recommendations for jobs after PhD? Europe based,5
Entry Level/Gain Experience,14
OD workshop options help! ,5
Econ and psychology double major?,3
"IO Psychologists working in industry, how do you access research and keep up with it?",28
Some questions from an undergraduate,7
"Bi-Weekly /r/IOpsychology Discussion - What have you been reading, and what do you think of it?",9
new haven vs hofstra,0
Criteria Corp Aptitude Test,1
Just got accepted to UHCLs IO MA Program,7
Career advancement ,6
IO folks working in the field - would you say that your work is interesting/meaningful/allows you to have work-life balance?,9
Join my psychology and typology based discord server! 18+,0
got an admit from unh,4
"Trying not to be discouraged, please help! Re: PhD in I/O Psych",3
Do you send thank you note email after each job interview?,5
Uncertain about the scope of I/O in India,10
Need Some Hope,40
"Flaired ""data"" because it is facts",58
Program decision help,3
Complementary studies for the degree?,5
Brining Resume to SIOP,5
Hood Color? ,2
Job Recommendations for recent undergraduate looking to get PhD in IO Psych,8
"Sociopaths, Losers and Clueless: Revisiting the Organizational Theory of The Office",0
IO-related certificate programs or short courses?,10
"Haven't heard back from over 70+ I/O psychology-related internships (HR, recruitment, Marketing, etc.) and summer is almost here. What am I doing wrong?",37
"Looking for reading suggestions to learn more about ""climbing the ladder"" in an organization",5
Is there any way to detect cheating during or after the test in psychometrics?,4
Best School for Online Organizational Psychology Masters Degree?,10
"Those of you in applied work, what are your experiences with R Studio?",16
Transition from Clinical to I/O; is a PhD worth it?,3
Ideas ,0
FT internal job with PT consulting side gig. A conflict of interest?,2
Role and pay transparency ,3
"Bi-Weekly /r/IOpsychology Discussion - What have you been reading, and what do you think of it?",6
Connect the Dots: Knowledge Networks &amp; Social Organizations,5
IO Job Posting,15
Looking for Consulting Firms that provide culture services amidst M&amp;A,3
Suggested reading before MSc in IO Psych (UK),3
Job hunting ,10
Help im confused!,4
Poster Printing at SIOP Conference site?,3
Minor in business?,3
Am I paranoid or the job market is actually bad?,29
HR options &amp; PhD ?s. ,6
Anyone in consulting?,8
Faculty with consulting business,6
Psychological safety measure ,4
EA has interesting selection criteria.,29
How did you find jobs in fields such as Change Management and Organisational Development? What does a typical day look like for you? Any advice for someone in the UK looking to pursue these roles?,2
"Besides funding, how can public policy support creativity in society?",4
Research related question ,0
Types of IO jobs? ,7
Hello fellow IO Psychologists! Do you think its ethical to use AI to generate psychometric assessments? ,10
Looking for advice in getting into consulting ,8
How to get my school to add an I/O psych class?,4
Angry reactions to a post about an intelligence test used in a hiring process. It's worth reading the comments for a clear take on why face validity and fairness perceptions matter to your selection system.,92
Need an IO Psychologist Interviewee!,5
"Those working in the netherlands, how much do you make with a masters degree from a dutch university ?",10
at what level does an msc org psych graduate applies for?,4
Looking for an Interviewee,4
Searching for Literature,8
"Bi-Weekly /r/IOpsychology Discussion - What have you been reading, and what do you think of it?",4
